{
  "$schema": "https://json-schema.org/draft/2020-12/schema",
  "$id": "https://github.com/ZeroSOC/zerosoc-skills/capabilities/source_profile.schema.json",
  "title": "ZeroSOC source profile",
  "description": "What one security technology's records mean in the framework's terms: where each required input of Detection & Analysis §1.1 lives, what the source's own words mean, where every field of its record lands on the Case, and which of the framework's questions it can answer. It changes when the framework changes. How to talk to the technology — authentication, endpoints, paging, query language, permissions — is not here: that changes when the vendor's API does and lives with the integration.",
  "type": "object",
  "required": [
    "source",
    "fields",
    "vocabularies",
    "case_map",
    "extension",
    "capability_coverage"
  ],
  "additionalProperties": false,
  "properties": {
    "source": {
      "type": "object",
      "required": [
        "id",
        "vendor",
        "product",
        "profile_version"
      ],
      "additionalProperties": false,
      "properties": {
        "id": {
          "type": "string",
          "description": "The identifier a capability binding names this profile by."
        },
        "vendor": {
          "type": "string"
        },
        "product": {
          "type": "string",
          "description": "The product name, as the Case's provenance records it."
        },
        "api": {
          "type": "string",
          "description": "The API and version these paths are read from."
        },
        "api_version": {
          "type": "string"
        },
        "profile_version": {
          "type": "string",
          "description": "The date this profile was last true of the source."
        },
        "description": {
          "type": "string"
        },
        "override": {
          "type": "object",
          "description": "Written by the loader, never by hand: present when the deployment read this profile through a local override (the binding's source_profile_overrides), and what the run records about it. A profile that ships carries none.",
          "required": [
            "file",
            "sha256",
            "reason",
            "base_profile_version",
            "stale",
            "paths"
          ],
          "additionalProperties": false,
          "properties": {
            "file": {
              "type": "string",
              "description": "The override's file name, beside the binding."
            },
            "sha256": {
              "type": "string",
              "description": "The digest of the override file as it was read."
            },
            "reason": {
              "type": "string",
              "description": "Why the deployment overrides the shipped profile, in its own words."
            },
            "base_profile_version": {
              "type": "string",
              "description": "The profile_version of the shipped profile the override was written against."
            },
            "stale": {
              "type": "boolean",
              "description": "The shipped profile has moved past that version: the fix the override stands in for may have landed."
            },
            "paths": {
              "type": "array",
              "items": {
                "type": "string"
              },
              "description": "What the override sets, as paths of this profile."
            }
          }
        }
      }
    },
    "fields": {
      "type": "object",
      "description": "Where each thing the framework needs lives on a record of this source. A path is dotted; [] steps into a list.",
      "required": [
        "case",
        "alert",
        "evidence"
      ],
      "additionalProperties": false,
      "properties": {
        "case": {
          "$ref": "#/$defs/paths"
        },
        "alert": {
          "$ref": "#/$defs/paths"
        },
        "evidence": {
          "$ref": "#/$defs/paths"
        },
        "telemetry_rows": {
          "type": "object",
          "additionalProperties": false,
          "description": "Where a row of this source's telemetry belongs in OCSF, for the evidence a Finding rests on. A column this table does not name is kept under its own name rather than dropped, so a mapping that lags the source loses nothing.",
          "properties": {
            "objects": {
              "type": "object",
              "additionalProperties": {
                "type": "array",
                "items": {
                  "type": "string"
                }
              },
              "description": "column -> the path of the OCSF object attribute it fills, as a list of steps."
            },
            "times": {
              "type": "array",
              "items": {
                "type": "string"
              },
              "description": "The columns a row states its time in, tried in turn."
            },
            "uids": {
              "type": "array",
              "items": {
                "type": "string"
              },
              "description": "What this source calls a row's own identifier."
            },
            "process_lineage": {
              "type": "object",
              "description": "What this source calls the columns a process lineage is rebuilt from, on a row of its process telemetry: the name the lineage script uses (device, pid, created, name, command_line, parent_pid, parent_created, parent_name, parent_command_line, parent_parent_pid, parent_parent_created) -> the source's column. It is apart from `objects` because the identity of a process is its device, its id and its creation time together, read as the source writes them, and not an attribute placed on an OCSF object.",
              "additionalProperties": {
                "type": "string"
              }
            }
          }
        }
      }
    },
    "vocabularies": {
      "type": "object",
      "description": "The source's own words, in the framework's and OCSF's terms. A word absent from a vocabulary is recorded as the source said it and never guessed at.",
      "required": [
        "severity",
        "status",
        "analytic_types",
        "remediation_states"
      ],
      "additionalProperties": false,
      "properties": {
        "severity": {
          "$ref": "#/$defs/id_map"
        },
        "status": {
          "$ref": "#/$defs/id_map"
        },
        "verdict": {
          "$ref": "#/$defs/id_map"
        },
        "determination": {
          "type": "object",
          "description": "The source's own account of WHAT the activity was, beside its verdict. Each word names the verdicts it may accompany, so an executor closing a Case in the source proposes only the words that verdict admits; `only` marks a verdict that admits one word, which is not a choice to make. A source with no such axis declares nothing here.",
          "additionalProperties": {
            "type": "object",
            "required": [
              "verdict_ids"
            ],
            "additionalProperties": false,
            "properties": {
              "verdict_ids": {
                "type": "array",
                "items": {
                  "type": "integer"
                },
                "minItems": 1,
                "description": "The framework verdicts this word may be written with."
              },
              "name": {
                "type": "string",
                "description": "The word as the source's own interface shows it."
              },
              "only": {
                "type": "boolean",
                "description": "This is the one word those verdicts admit: it is written without asking."
              },
              "note": {
                "type": "string"
              }
            }
          }
        },
        "analytic_types": {
          "type": "object",
          "description": "Detection source -> the OCSF analytic type it is. One not listed is Other (99).",
          "additionalProperties": {
            "type": "object",
            "required": [
              "type_id",
              "type"
            ],
            "additionalProperties": false,
            "properties": {
              "type_id": {
                "type": "integer"
              },
              "type": {
                "type": "string"
              }
            }
          }
        },
        "remediation_states": {
          "type": "object",
          "description": "What the source says it did to an entity. One not listed is recorded as reported and never treated as neutralized.",
          "additionalProperties": {
            "type": "object",
            "required": [
              "neutralized"
            ],
            "additionalProperties": false,
            "properties": {
              "neutralized": {
                "type": "boolean",
                "description": "Whether the entity was taken out of play."
              },
              "status": {
                "type": [
                  "string",
                  "null"
                ],
                "description": "OCSF Remediation Activity status."
              },
              "activity": {
                "type": [
                  "string",
                  "null"
                ],
                "description": "OCSF Remediation Activity: Isolate, Evict, Restore. Null where the source did nothing to the entity."
              },
              "note": {
                "type": "string"
              }
            }
          }
        }
      }
    },
    "case_map": {
      "type": "array",
      "description": "Every path of the source's record: where it lands on the Case, or why nothing reads it. This is the block that makes silence impossible — a field the vendor adds tomorrow is neither mapped nor ignored, and the completeness test fails.",
      "minItems": 1,
      "items": {
        "type": "object",
        "required": [
          "path"
        ],
        "additionalProperties": false,
        "properties": {
          "path": {
            "type": "string",
            "description": "Dotted path on the source's record; [] steps into a list."
          },
          "case": {
            "type": [
              "string",
              "array"
            ],
            "items": {
              "type": "string"
            },
            "minItems": 1,
            "description": "Where it lands on the Case, as a dotted path of the Case Schema ([] steps into a list; the source's own object is addressed by its extension key). A list where one path of the source lands in more than one place."
          },
          "ignored": {
            "type": "string",
            "description": "Why nothing reads it. A reason, never a blank."
          },
          "note": {
            "type": "string"
          }
        }
      }
    },
    "extension": {
      "type": "object",
      "description": "The object this source keeps on the Case for what it states and the framework has no field for.",
      "required": [
        "key",
        "properties"
      ],
      "additionalProperties": false,
      "properties": {
        "key": {
          "type": "string",
          "description": "The Case attribute this source's object is under."
        },
        "description": {
          "type": "string"
        },
        "properties": {
          "type": "object",
          "additionalProperties": {
            "type": "object",
            "required": [
              "type",
              "from"
            ],
            "additionalProperties": false,
            "properties": {
              "type": {
                "type": "string",
                "enum": [
                  "string",
                  "integer",
                  "boolean"
                ]
              },
              "from": {
                "type": "string",
                "description": "The path on the source's record it is read from."
              },
              "description": {
                "type": "string"
              }
            }
          }
        }
      }
    },
    "capability_coverage": {
      "type": "object",
      "description": "What of the framework's questions this source answers, and how well.",
      "required": [
        "capabilities"
      ],
      "additionalProperties": false,
      "properties": {
        "capabilities": {
          "type": "object",
          "description": "capability class -> what this source answers of it.",
          "additionalProperties": {
            "type": "object",
            "required": [
              "answers"
            ],
            "additionalProperties": false,
            "properties": {
              "answers": {
                "type": "string",
                "description": "The question it answers, in the method's terms."
              },
              "limits": {
                "type": "array",
                "items": {
                  "type": "string"
                },
                "description": "What it does not answer, or answers partly: the licence tier, the retention window, the field that is null."
              },
              "operation": {
                "type": "string",
                "description": "The integration's operation, where one name is stable enough to record."
              }
            }
          }
        },
        "data_sources": {
          "type": "object",
          "description": "required_data_sources name, exactly as a playbook writes it -> whether this source can answer it, with the query recipe or the alerts that do. What the source can answer is not what a deployment has: a licence tier without the telemetry tables answers none of the recipes, and it is the deployment's binding that says so.",
          "additionalProperties": {
            "type": "boolean"
          }
        }
      }
    },
    "queries": {
      "type": "object",
      "description": "Per question kind, the recipe that asks it of this tool.",
      "additionalProperties": {
        "type": "object",
        "required": [
          "asks"
        ],
        "additionalProperties": false,
        "properties": {
          "asks": {
            "type": "string",
            "description": "The question, in the method's terms."
          },
          "table": {
            "type": "string"
          },
          "recipe": {
            "type": "string",
            "description": "The query, in the tool's own language, with the entity as a parameter."
          },
          "limits": {
            "type": "array",
            "items": {
              "type": "string"
            }
          }
        }
      }
    }
  },
  "$defs": {
    "paths": {
      "type": "object",
      "description": "name the framework uses -> path on the source's record.",
      "additionalProperties": {
        "type": "string"
      }
    },
    "id_map": {
      "type": "object",
      "description": "The source's word -> the framework's id and name.",
      "additionalProperties": {
        "type": "object",
        "required": [
          "id",
          "name"
        ],
        "additionalProperties": false,
        "properties": {
          "id": {
            "type": "integer"
          },
          "name": {
            "type": "string"
          },
          "note": {
            "type": "string"
          }
        }
      }
    }
  }
}
