{
  "source": {
    "id": "defender-xdr",
    "vendor": "Microsoft",
    "product": "Microsoft Defender XDR",
    "api": "Microsoft Graph security API",
    "api_version": "v1.0",
    "profile_version": "2026-09-21",
    "description": "An incident of this source is a Case: same identifier, its alerts the Case's alerts, its evidence the Case's observables."
  },
  "fields": {
    "case": {
      "uid": "id",
      "title": "displayName",
      "severity": "severity",
      "status": "status",
      "tenant": "tenantId",
      "last_update_time": "lastUpdateDateTime",
      "created_time": "createdDateTime",
      "master_uid": "redirectIncidentId",
      "alerts": "alerts",
      "comments": "comments",
      "url": "incidentWebUrl",
      "classification": "classification"
    },
    "alert": {
      "uid": "id",
      "title": "title",
      "severity": "severity",
      "evidence": "evidence",
      "first_activity_time": "firstActivityDateTime",
      "last_activity_time": "lastActivityDateTime",
      "created_time": "createdDateTime",
      "product": "productName",
      "techniques": "mitreTechniques",
      "threat_name": "threatDisplayName",
      "threat_family": "threatFamilyName",
      "detection_source": "detectionSource",
      "detector_id": "detectorId",
      "description": "description",
      "recommended_actions": "recommendedActions"
    },
    "evidence": {
      "type": "@odata.type",
      "verdict": "verdict",
      "remediation_status": "remediationStatus",
      "remediation_status_details": "remediationStatusDetails"
    },
    "telemetry_rows": {
      "objects": {
        "FileName": [
          "process",
          "name"
        ],
        "ProcessCommandLine": [
          "process",
          "cmd_line"
        ],
        "ProcessId": [
          "process",
          "pid"
        ],
        "InitiatingProcessFileName": [
          "process",
          "parent_process",
          "name"
        ],
        "InitiatingProcessCommandLine": [
          "process",
          "parent_process",
          "cmd_line"
        ],
        "SHA256": [
          "file",
          "hashes",
          "sha256"
        ],
        "FileHash": [
          "file",
          "hashes",
          "sha256"
        ],
        "FolderPath": [
          "file",
          "path"
        ],
        "DeviceName": [
          "device",
          "hostname"
        ],
        "DeviceId": [
          "device",
          "uid"
        ],
        "AccountName": [
          "user",
          "name"
        ],
        "AccountUpn": [
          "user",
          "name"
        ],
        "UserPrincipalName": [
          "user",
          "name"
        ],
        "RemoteIP": [
          "dst_endpoint",
          "ip"
        ],
        "RemotePort": [
          "dst_endpoint",
          "port"
        ],
        "RemoteUrl": [
          "url",
          "url_string"
        ],
        "Url": [
          "url",
          "url_string"
        ],
        "LocalIP": [
          "src_endpoint",
          "ip"
        ],
        "LocalPort": [
          "src_endpoint",
          "port"
        ],
        "IPAddress": [
          "src_endpoint",
          "ip"
        ]
      },
      "times": [
        "Timestamp",
        "TimeGenerated",
        "EventTime",
        "createdDateTime",
        "LastSeen"
      ],
      "uids": [
        "ReportId",
        "EventId",
        "id",
        "uid"
      ],
      "process_lineage": {
        "device": "DeviceName",
        "pid": "ProcessId",
        "created": "ProcessCreationTime",
        "name": "FileName",
        "command_line": "ProcessCommandLine",
        "parent_pid": "InitiatingProcessId",
        "parent_created": "InitiatingProcessCreationTime",
        "parent_name": "InitiatingProcessFileName",
        "parent_command_line": "InitiatingProcessCommandLine",
        "parent_parent_pid": "InitiatingProcessParentId",
        "parent_parent_created": "InitiatingProcessParentCreationTime"
      }
    }
  },
  "vocabularies": {
    "severity": {
      "informational": {
        "id": 1,
        "name": "Informational"
      },
      "low": {
        "id": 2,
        "name": "Low"
      },
      "medium": {
        "id": 3,
        "name": "Medium"
      },
      "high": {
        "id": 4,
        "name": "High"
      },
      "unknown": {
        "id": 1,
        "name": "Informational",
        "note": "the source says nothing; the Case starts at the bottom and triage sets it"
      }
    },
    "status": {
      "active": {
        "id": 1,
        "name": "New"
      },
      "inProgress": {
        "id": 2,
        "name": "In Progress"
      },
      "awaitingAction": {
        "id": 3,
        "name": "On Hold"
      },
      "resolved": {
        "id": 4,
        "name": "Resolved",
        "note": "the source's own closure of its record; the Case is closed by its own verdict, and the two are not the same event"
      },
      "redirected": {
        "id": 5,
        "name": "Closed",
        "note": "merged into another incident: the Case closes as a Duplicate of its master"
      }
    },
    "verdict": {
      "unknown": {
        "id": 0,
        "name": "Unknown",
        "note": "the source has not classified the incident, which is how every incident starts and how many are left when they are resolved there"
      },
      "falsePositive": {
        "id": 1,
        "name": "False Positive"
      },
      "truePositive": {
        "id": 2,
        "name": "True Positive"
      },
      "informationalExpectedActivity": {
        "id": 5,
        "name": "Benign",
        "note": "activity that was real and expected: the framework's Benign, authorized activity that legitimately matched the detection"
      }
    },
    "determination": {
      "multiStagedAttack": {
        "verdict_ids": [
          2
        ],
        "name": "Multistage attack"
      },
      "malware": {
        "verdict_ids": [
          2
        ],
        "name": "Malware"
      },
      "unwantedSoftware": {
        "verdict_ids": [
          2
        ],
        "name": "Unwanted software"
      },
      "phishing": {
        "verdict_ids": [
          2
        ],
        "name": "Phishing"
      },
      "compromisedAccount": {
        "verdict_ids": [
          2
        ],
        "name": "Compromised account"
      },
      "maliciousUserActivity": {
        "verdict_ids": [
          2
        ],
        "name": "Malicious user activity"
      },
      "apt": {
        "verdict_ids": [
          2
        ],
        "name": "APT"
      },
      "securityTesting": {
        "verdict_ids": [
          5
        ],
        "name": "Security testing"
      },
      "lineOfBusinessApplication": {
        "verdict_ids": [
          5
        ],
        "name": "Line-of-business application"
      },
      "confirmedActivity": {
        "verdict_ids": [
          5
        ],
        "name": "Confirmed activity"
      },
      "securityPersonnel": {
        "verdict_ids": [
          5
        ],
        "name": "Security personnel"
      },
      "notMalicious": {
        "verdict_ids": [
          1
        ],
        "name": "Not malicious",
        "only": true,
        "note": "the one determination a False Positive admits: the activity the detection reported was not there"
      },
      "notEnoughDataToValidate": {
        "verdict_ids": [
          7
        ],
        "name": "Not enough data to validate",
        "only": true,
        "note": "Insufficient Data: the checks could not be run or answered, and the record says so rather than claiming a verdict"
      },
      "other": {
        "verdict_ids": [
          2,
          5
        ],
        "name": "Other",
        "note": "a True Positive or a Benign whose kind none of the words above states"
      }
    },
    "analytic_types": {
      "customDetection": {
        "type_id": 1,
        "type": "Rule"
      },
      "microsoftDefenderForCloud": {
        "type_id": 1,
        "type": "Rule"
      },
      "microsoftSentinel": {
        "type_id": 1,
        "type": "Rule"
      },
      "microsoft365Defender": {
        "type_id": 2,
        "type": "Behavioral"
      },
      "microsoftDefenderForCloudApps": {
        "type_id": 2,
        "type": "Behavioral"
      },
      "microsoftDefenderForEndpoint": {
        "type_id": 2,
        "type": "Behavioral"
      },
      "microsoftDefenderForIdentity": {
        "type_id": 2,
        "type": "Behavioral"
      },
      "microsoftDefenderForOffice365": {
        "type_id": 2,
        "type": "Behavioral"
      },
      "azureAdIdentityProtection": {
        "type_id": 4,
        "type": "Learning (ML/DL)"
      },
      "antivirus": {
        "type_id": 5,
        "type": "Fingerprinting"
      },
      "customTi": {
        "type_id": 5,
        "type": "Fingerprinting"
      },
      "smartScreen": {
        "type_id": 5,
        "type": "Fingerprinting"
      },
      "automatedInvestigation": {
        "type_id": 99,
        "type": "Other"
      },
      "manual": {
        "type_id": 99,
        "type": "Other"
      }
    },
    "remediation_states": {
      "prevented": {
        "neutralized": true,
        "status": "Success",
        "activity": "Evict"
      },
      "blocked": {
        "neutralized": true,
        "status": "Success",
        "activity": "Evict"
      },
      "remediated": {
        "neutralized": true,
        "status": "Success",
        "activity": "Evict"
      },
      "quarantined": {
        "neutralized": true,
        "status": "Success",
        "activity": "Isolate"
      },
      "isolated": {
        "neutralized": true,
        "status": "Success",
        "activity": "Isolate"
      },
      "suspended": {
        "neutralized": true,
        "status": "Success",
        "activity": "Isolate"
      },
      "active": {
        "neutralized": false,
        "status": "Unknown",
        "activity": null